{
  "activation_policy": "separate-explicit-user-approval-required",
  "completion_claim": {
    "full_workflow_ready": false,
    "overall_status": "source-complete-operationally-pending",
    "source_wide_integration_complete": true
  },
  "operational_gates": [
    {
      "evidence_refs": [],
      "id": "actual-a7-handoff-complete",
      "status": "pending"
    },
    {
      "evidence_refs": [],
      "id": "current-objective-approved",
      "status": "pending"
    },
    {
      "evidence_refs": [],
      "id": "current-run-objective-achieved",
      "status": "pending"
    },
    {
      "evidence_refs": [],
      "id": "personal-profile-pilots-completed",
      "status": "pending"
    },
    {
      "evidence_refs": [],
      "id": "objective-audit-completed",
      "status": "pending"
    },
    {
      "evidence_refs": [],
      "id": "run-outcome-decided",
      "status": "pending"
    },
    {
      "evidence_refs": [],
      "id": "archive-or-continue-completed",
      "status": "pending"
    },
    {
      "evidence_refs": [],
      "id": "live-runtime-verified",
      "status": "pending"
    },
    {
      "evidence_refs": [],
      "id": "nix-generation-build-verified",
      "status": "pending"
    },
    {
      "evidence_refs": [],
      "id": "nix-rebuild-verified",
      "status": "pending"
    },
    {
      "evidence_refs": [],
      "id": "migration-complete",
      "status": "pending"
    },
    {
      "evidence_refs": [],
      "id": "activation-complete",
      "status": "pending"
    },
    {
      "evidence_refs": [],
      "id": "full-workflow-operational-adoption-approved",
      "status": "pending"
    }
  ],
  "product_id": "personal-ai-agent-workflow-v1",
  "schema": "agent-workflow-implementation-status/v1",
  "source_authority": {
    "catalog_ref": {
      "digest": "sha256:4ae2f11b89eedabc4c4a5cf71f96d4041c94ed58a48f6c1e75172ae648fe7c0d",
      "path": "docs/plans/ai-agent-workflow-step-catalog.md"
    },
    "plan_coverage_ref": {
      "digest": "sha256:0840707f06d2fb8bd357a44ea3ec4129e5e67ce52f32dbb6a9b33783b07fdf2c",
      "path": "agent-workflows/manifests/plan-coverage.json"
    },
    "plan_ref": {
      "digest": "sha256:c8e10469fcf310e913f7520990b833e259daf5d0d3144defdcd4ba31d5b46524",
      "path": "docs/plans/ai-agent-workflow-full-implementation-plan.md"
    },
    "source_evidence_index_ref": {
      "digest": "sha256:d751ef4f0964312ebf8ecb9b538fe1741c8b625d2df8f8a985bc8993b5f671ea",
      "path": "agent-workflows/manifests/source-evidence-index.json"
    },
    "source_fixture_refs": [
      {
        "digest": "sha256:d35c72242683ea9e710efb62a925877490f4769fd70d17e6fd3fefd3d5e85c33",
        "path": "agent-workflows/evidence/source-wide/profile-feature.json"
      },
      {
        "digest": "sha256:7c1a1f398db5313ad977237e5642cf429e3440beebf0a4767ab35f18c7a671ab",
        "path": "agent-workflows/evidence/source-wide/profile-bug-fix.json"
      },
      {
        "digest": "sha256:6ea4d1be582776ca89c94deb734385946262a71c7e04a4ff38ca6e4f53b3e2dd",
        "path": "agent-workflows/evidence/source-wide/profile-improvement.json"
      },
      {
        "digest": "sha256:b74e2cae76dcc5b7126d6835630ed320bd538b20e907595a6e9bff01c842f9f3",
        "path": "agent-workflows/evidence/source-wide/cold-resume.json"
      },
      {
        "digest": "sha256:d3b4a19c1c58be45e429cbfa6f0e76a936f111f1eb19245f78a1bd0cd488ed17",
        "path": "agent-workflows/evidence/source-wide/h1-h2-h3-skeleton.json"
      }
    ],
    "source_release_ref": {
      "digest": "sha256:8450824b5f6dbe71e1cbc8e140d8298462534763c54cbeab3734d0913e2a27f0",
      "path": "agent-workflows/manifests/source-release.json"
    }
  },
  "source_gates": [
    {
      "evidence_refs": [
        {
          "digest": "sha256:14f7f3bdec3e7054be5d8e29f5b2c9892605d5c94a6c5df2792147c8c86b870a",
          "kind": "compiled-catalog-present",
          "path": "agent-workflows/evidence/compiled-catalog-present.json",
          "schema": "agent-workflow-source-gate-evidence/compiled-catalog-present/v1"
        }
      ],
      "id": "compiled-catalog-present",
      "status": "passed"
    },
    {
      "evidence_refs": [
        {
          "digest": "sha256:8914ae8e6e29c51b0c1ef7fe2c8f260969f60838a45b5a4e502754ac2e42b1da",
          "kind": "group-manifests-implemented",
          "path": "agent-workflows/evidence/group-manifests-implemented.json",
          "schema": "agent-workflow-source-gate-evidence/group-manifests-implemented/v1"
        }
      ],
      "id": "group-manifests-implemented",
      "status": "passed"
    },
    {
      "evidence_refs": [
        {
          "digest": "sha256:e1018b7e662b3b5e1941dfcb4d01444cef5e47c3764a89c645b3141f3853bc3b",
          "kind": "workflow-profiles-implemented",
          "path": "agent-workflows/evidence/workflow-profiles-implemented.json",
          "schema": "agent-workflow-source-gate-evidence/workflow-profiles-implemented/v1"
        }
      ],
      "id": "workflow-profiles-implemented",
      "status": "passed"
    },
    {
      "evidence_refs": [
        {
          "digest": "sha256:691c927016eb47cb093f5282e7c64b5736d8565c50e6dd288241d7538716caba",
          "kind": "two-stage-review-integrated-across-workflows",
          "path": "agent-workflows/evidence/two-stage-review-integrated-across-workflows.json",
          "schema": "agent-workflow-source-gate-evidence/two-stage-review-integrated-across-workflows/v1"
        }
      ],
      "id": "two-stage-review-integrated-across-workflows",
      "status": "passed"
    },
    {
      "evidence_refs": [
        {
          "digest": "sha256:4f4d05e57278862d39c0a2905083943c924ce37aab21699f9d9e1f0ea0aed885",
          "kind": "release-readiness-review-completed",
          "path": "agent-workflows/evidence/release-readiness-review-completed.json",
          "schema": "agent-workflow-source-gate-evidence/release-readiness-review-completed/v1"
        }
      ],
      "id": "release-readiness-review-completed",
      "status": "passed"
    },
    {
      "evidence_refs": [
        {
          "digest": "sha256:0fbb5ae57499a4c1b9ae1795d066c0f213db4c0965f2036893eced6a8673ce3f",
          "kind": "source-wide-integration-completed",
          "path": "agent-workflows/evidence/source-wide-integration-completed.json",
          "schema": "agent-workflow-source-gate-evidence/source-wide-integration-completed/v1"
        }
      ],
      "id": "source-wide-integration-completed",
      "status": "passed"
    }
  ]
}
